{
  "schema_version": 1,
  "ref": "plus://yolov9s-320-fixture",
  "source": {
    "kind": "onnx",
    "sha256": "0000000000000000000000000000000000000000000000000000000000000000",
    "size_bytes": 1
  },
  "input": {
    "tensor_name": "images",
    "shape": [1, 3, 320, 320],
    "dtype": "float32",
    "layout": "nchw",
    "pixel_format": "rgb",
    "normalization": {"scale": 0.00392156862745098, "mean": [0.0, 0.0, 0.0], "std": [1.0, 1.0, 1.0]}
  },
  "output": {
    "profile": "yolo-raw",
    "layout": "cxcywh",
    "coordinate_units": "pixels",
    "class_count": 80,
    "objectness": false,
    "tensors": [
      {"name": "output0", "shape": [1, 84, 2100], "dtype": "float32"}
    ]
  },
  "serving": {
    "label_map": {
      "0": "person", "1": "bicycle", "2": "car", "3": "motorcycle",
      "4": "airplane", "5": "bus", "6": "train", "7": "truck",
      "9": "traffic light"
    },
    "decoder": "yolo-raw-nms",
    "decoder_version": "yolo-raw-nms-v1",
    "score_threshold": 0.25,
    "nms_iou": 0.45
  },
  "target": {
    "profile": "xc10AIE2P_ML-die-0x-e-S-es1"
  },
  "provenance": {
    "note": "Fixture only. source.sha256 is a zero placeholder: fixtures never satisfy a real cache lookup. Label IDs are standard COCO-80 numerics for the public fixture family. No artifact/runtime ABI IDs are claimed here: they are assigned by activation validation (Task 04), never invented."
  }
}
