{
  "schema_version": 1,
  "ref": "plus://private-example-0000",
  "source": {
    "kind": "onnx",
    "sha256": "ffffffffffffffffffffffffffffffffffffffffffffffffffffffffffffffff",
    "size_bytes": 1
  },
  "input": {
    "tensor_name": "images",
    "shape": [1, 3, 320, 320],
    "dtype": "float32",
    "layout": "nchw",
    "pixel_format": "rgb",
    "normalization": {"scale": 0.00392156862745098, "mean": [0.0, 0.0, 0.0], "std": [1.0, 1.0, 1.0]}
  },
  "output": {
    "profile": "yolo-raw",
    "layout": "cxcywh",
    "coordinate_units": "pixels",
    "class_count": 7,
    "objectness": false,
    "tensors": [
      {"name": "output0", "shape": [1, 11, 2100], "dtype": "float32"}
    ]
  },
  "serving": {
    "label_map": {
      "0": "forklift",
      "1": "pallet",
      "2": "safety_cone",
      "4": "hard_hat",
      "6": "loading_dock_door"
    },
    "attributes_map": {
      "forklift": ["beacon_on"],
      "pallet": ["wrapped", "stacked"]
    },
    "decoder": "yolo-raw-nms",
    "decoder_version": "yolo-raw-nms-v1",
    "score_threshold": 0.4,
    "nms_iou": 0.5
  },
  "target": {
    "profile": "xc10AIE2P_ML-die-0x-e-S-es1"
  },
  "provenance": {
    "note": "Synthetic private-Plus-style example. Sparse non-COCO IDs and attributes prove the decoder never assumes COCO-80. Not a real Plus model."
  }
}
